<?xml version="1.0" encoding="utf-8"?>
<!--
	BSfileC10 node-extension-property_CN.xml
	扩展节点名称描述定义文件

	Version 1.0 - 2021年9月1日
-->
<element-properties xmlns:xml="http://www.w3.org/XML/1998/namespace" xmlns:xsi="http://www.w3.org/2001/XMLSchema-instance" xsi:noNamespaceSchemaLocation="cn-elements.xsd">
  <version number="1.0" valid-from="2021-9-1">
    <element name="node-extension" structureno="3.2.R.1">
      <description xml:lang="zh">3.2.R.1工艺验证</description>
    </element>
    <element name="node-extension" structureno="3.2.R.2">
      <description xml:lang="zh">3.2.R.2批记录</description>
    </element>
    <element name="node-extension" structureno="3.2.R.3">
      <description xml:lang="zh">3.2.R.3分析方法验证报告</description>
    </element>
    <element name="node-extension" structureno="3.2.R.4">
      <description xml:lang="zh">3.2.R.4稳定性图谱</description>
    </element>
    <element name="node-extension" structureno="3.2.R.5">
      <description xml:lang="zh">3.2.R.5可比性方案</description>
    </element>
    <element name="node-extension" structureno="3.2.R.6">
      <description xml:lang="zh">3.2.R.6其他</description>
    </element>
  </version>
</element-properties>